{
  "$schema": "https://json-schema.org/draft/2020-12/schema",
  "$id": "urn:officecli:hcd-patch:3",
  "title": "HTML Canonical Document patch batch with presentation and image edits",
  "type": "object",
  "additionalProperties": false,
  "required": ["schemaVersion", "documentId", "patchId", "baseRevision", "operations"],
  "properties": {
    "schemaVersion": { "const": "hcd-patch/3" },
    "documentId": { "type": "string", "minLength": 1, "maxLength": 256 },
    "patchId": { "type": "string", "minLength": 1, "maxLength": 256 },
    "baseRevision": { "type": "integer", "minimum": 0, "maximum": 100000 },
    "actor": {
      "type": "object",
      "maxProperties": 64,
      "propertyNames": { "minLength": 1, "maxLength": 256 },
      "additionalProperties": { "type": "string", "maxLength": 65536 }
    },
    "metadata": {
      "type": "object",
      "maxProperties": 128,
      "propertyNames": { "minLength": 1, "maxLength": 256 },
      "additionalProperties": { "type": "string", "maxLength": 262144 }
    },
    "operations": {
      "type": "array",
      "minItems": 1,
      "maxItems": 10000,
      "items": {
        "oneOf": [
          { "$ref": "#/$defs/textSplice" },
          { "$ref": "#/$defs/nodeStyle" },
          { "$ref": "#/$defs/imageReplace" },
          { "$ref": "#/$defs/imageGeometry" },
          { "$ref": "#/$defs/annotationUpsert" },
          { "$ref": "#/$defs/annotationRemove" }
        ]
      }
    }
  },
  "$defs": {
    "sha256": { "type": "string", "pattern": "^[0-9a-f]{64}$" },
    "nodeId": { "type": "string", "pattern": "^n_[0-9a-f]{32}$" },
    "precondition": {
      "type": "object",
      "additionalProperties": false,
      "required": ["nodeHash"],
      "properties": { "nodeHash": { "$ref": "#/$defs/sha256" } }
    },
    "visualPrecondition": {
      "type": "object",
      "additionalProperties": false,
      "required": ["visualHash"],
      "properties": { "visualHash": { "$ref": "#/$defs/sha256" } }
    },
    "textSplice": {
      "type": "object",
      "additionalProperties": false,
      "required": ["op", "nodeId", "start", "deleteCount", "insertText", "precondition"],
      "properties": {
        "op": { "const": "text.splice" },
        "nodeId": { "$ref": "#/$defs/nodeId" },
        "start": { "type": "integer", "minimum": 0 },
        "deleteCount": { "type": "integer", "minimum": 0 },
        "insertText": { "type": "string", "maxLength": 2097152 },
        "precondition": { "$ref": "#/$defs/precondition" }
      }
    },
    "color": { "type": "string", "pattern": "^#[0-9A-Fa-f]{6}$" },
    "border": {
      "type": "object",
      "additionalProperties": false,
      "required": ["color", "widthPt", "style"],
      "properties": {
        "color": { "$ref": "#/$defs/color" },
        "widthPt": { "type": "number", "exclusiveMinimum": 0, "maximum": 12 },
        "style": { "enum": ["solid", "dashed", "dotted", "double"] }
      }
    },
    "nodeStyle": {
      "type": "object",
      "additionalProperties": false,
      "required": ["op", "nodeId", "style", "precondition"],
      "properties": {
        "op": { "const": "node.style" },
        "nodeId": { "$ref": "#/$defs/nodeId" },
        "style": {
          "type": "object",
          "additionalProperties": false,
          "minProperties": 1,
          "properties": {
            "textColor": { "$ref": "#/$defs/color" },
            "backgroundColor": { "$ref": "#/$defs/color" },
            "border": { "$ref": "#/$defs/border" }
          }
        },
        "precondition": { "$ref": "#/$defs/precondition" }
      }
    },
    "imageReplace": {
      "type": "object",
      "additionalProperties": false,
      "required": ["op", "nodeId", "assetHash", "precondition"],
      "properties": {
        "op": { "const": "image.replace" },
        "nodeId": { "$ref": "#/$defs/nodeId" },
        "assetHash": { "$ref": "#/$defs/sha256" },
        "precondition": { "$ref": "#/$defs/visualPrecondition" }
      }
    },
    "geometry": {
      "type": "object",
      "additionalProperties": false,
      "required": ["x", "y", "width", "height", "unit"],
      "properties": {
        "x": { "type": "number", "minimum": -1000000000000, "maximum": 1000000000000 },
        "y": { "type": "number", "minimum": -1000000000000, "maximum": 1000000000000 },
        "width": { "type": "number", "exclusiveMinimum": 0, "maximum": 1000000000000 },
        "height": { "type": "number", "exclusiveMinimum": 0, "maximum": 1000000000000 },
        "unit": { "enum": ["emu", "pt"] }
      }
    },
    "imageGeometry": {
      "type": "object",
      "additionalProperties": false,
      "required": ["op", "nodeId", "geometry", "precondition"],
      "properties": {
        "op": { "const": "image.geometry" },
        "nodeId": { "$ref": "#/$defs/nodeId" },
        "geometry": { "$ref": "#/$defs/geometry" },
        "precondition": { "$ref": "#/$defs/visualPrecondition" }
      }
    },
    "annotation": {
      "type": "object",
      "additionalProperties": false,
      "required": ["annotationId", "nodeId", "start", "end", "kind", "ignored"],
      "properties": {
        "annotationId": { "type": "string", "minLength": 1, "maxLength": 256 },
        "nodeId": { "$ref": "#/$defs/nodeId" },
        "start": { "type": "integer", "minimum": 0 },
        "end": { "type": "integer", "minimum": 0 },
        "kind": { "type": "string", "minLength": 1, "maxLength": 128 },
        "ruleId": { "type": "string", "minLength": 1, "maxLength": 256 },
        "confidence": { "type": "number", "minimum": 0, "maximum": 1 },
        "ignored": { "type": "boolean" }
      }
    },
    "annotationUpsert": {
      "type": "object",
      "additionalProperties": false,
      "required": ["op", "annotation"],
      "properties": {
        "op": { "const": "annotation.upsert" },
        "annotation": { "$ref": "#/$defs/annotation" }
      }
    },
    "annotationRemove": {
      "type": "object",
      "additionalProperties": false,
      "required": ["op", "annotationId"],
      "properties": {
        "op": { "const": "annotation.remove" },
        "annotationId": { "type": "string", "minLength": 1, "maxLength": 256 }
      }
    }
  }
}
